{
  "$schema": "https://json-schema.org/draft/2020-12/schema",
  "$id": "https://raw.githubusercontent.com/Elizabeth1979/accessibility-evidence-engine/main/packages/schemas/json/run.schema.json",
  "title": "AEE Run",
  "type": "object",
  "required": ["id", "version", "startedAt", "status"],
  "properties": {
    "id": {
      "$ref": "./common.schema.json#/$defs/uid"
    },
    "version": {
      "type": "string"
    },
    "startedAt": {
      "$ref": "./common.schema.json#/$defs/isoTimestamp"
    },
    "finishedAt": {
      "$ref": "./common.schema.json#/$defs/isoTimestamp"
    },
    "status": {
      "type": "string",
      "enum": ["pending", "running", "completed", "failed", "cancelled"]
    },
    "checkpoints": {
      "type": "array",
      "items": {
        "$ref": "./checkpoint.schema.json"
      }
    },
    "interactions": {
      "type": "array",
      "items": {
        "$ref": "./interaction.schema.json"
      }
    },
    "results": {
      "$ref": "./common.schema.json#/$defs/runSummary"
    },
    "environment": {
      "type": "object"
    },
    "config": {
      "type": "object"
    }
  },
  "additionalProperties": false
}
