{
  "id": "recorded-modal-focus-fixed",
  "version": "0.1.0",
  "startedAt": "2026-09-04T11:48:17.732Z",
  "status": "completed",
  "environment": {
    "mode": "playwright-page"
  },
  "config": {
    "writeReports": true,
    "policyName": "public-demo",
    "capturePolicy": {
      "includeScreenshots": true,
      "includeAccessibilityTree": true,
      "includeDomSnapshot": true,
      "stabilizeAfterInteractionMs": 500
    },
    "selectedObservers": [
      "dom",
      "focus",
      "visual"
    ]
  },
  "checkpoints": [
    {
      "id": "checkpoint:manual:1788522497732",
      "runId": "recorded-modal-focus-fixed",
      "name": "public-demo-modal-focus-fixed",
      "url": "./demo-fixture.html?label=fixed&focus=fixed",
      "timestamp": "2026-09-04T11:48:17.732Z",
      "trigger": "manual"
    }
  ],
  "interactions": [
    {
      "id": "interaction:click:1788522497732",
      "runId": "recorded-modal-focus-fixed",
      "timestamp": "2026-09-04T11:48:17.732Z",
      "actor": "test",
      "kind": "click",
      "target": {
        "role": "button",
        "name": "Delete Project Alpha"
      },
      "meta": {
        "focusExpectation": "inside-dialog"
      }
    }
  ],
  "finishedAt": "2026-09-04T11:48:18.292Z",
  "results": {
    "pass": 3,
    "fail": 0,
    "unknown": 0
  }
}