{
  "id": "recorded-modal-focus-issue",
  "version": "0.1.0",
  "startedAt": "2026-09-02T18:01:37.560Z",
  "status": "completed",
  "environment": {
    "mode": "playwright-page"
  },
  "config": {
    "writeReports": true,
    "policyName": "public-demo",
    "capturePolicy": {
      "includeScreenshots": true,
      "includeAccessibilityTree": true,
      "includeDomSnapshot": true,
      "stabilizeAfterInteractionMs": 500
    },
    "selectedObservers": [
      "dom",
      "focus",
      "visual"
    ]
  },
  "checkpoints": [
    {
      "id": "checkpoint:manual:1788372097560",
      "runId": "recorded-modal-focus-issue",
      "name": "public-demo-modal-focus-broken",
      "url": "./?recording=1&label=fixed&focus=broken",
      "timestamp": "2026-09-02T18:01:37.560Z",
      "trigger": "manual"
    }
  ],
  "interactions": [
    {
      "id": "interaction:click:1788372097560",
      "runId": "recorded-modal-focus-issue",
      "timestamp": "2026-09-02T18:01:37.560Z",
      "actor": "test",
      "kind": "click",
      "target": {
        "role": "button",
        "name": "Delete Project Alpha"
      },
      "meta": {
        "focusExpectation": "inside-dialog"
      }
    }
  ],
  "finishedAt": "2026-09-02T18:01:38.170Z",
  "results": {
    "pass": 1,
    "fail": 2,
    "unknown": 0
  }
}