{
  "id": "recorded-keyboard-save-issue",
  "version": "0.1.0",
  "startedAt": "2026-08-31T18:59:38.482Z",
  "status": "completed",
  "environment": {
    "mode": "playwright-page"
  },
  "config": {
    "writeReports": true,
    "policyName": "public-demo",
    "capturePolicy": {
      "includeScreenshots": true,
      "includeAccessibilityTree": true,
      "includeDomSnapshot": true,
      "stabilizeAfterInteractionMs": 500
    },
    "selectedObservers": [
      "dom",
      "focus",
      "visual"
    ]
  },
  "checkpoints": [
    {
      "id": "checkpoint:manual:1788202778482",
      "runId": "recorded-keyboard-save-issue",
      "name": "public-demo-broken",
      "url": "http://127.0.0.1:4173/?recording=1&implementation=broken",
      "timestamp": "2026-08-31T18:59:38.482Z",
      "trigger": "manual"
    }
  ],
  "interactions": [
    {
      "id": "interaction:enter:1788202778482",
      "runId": "recorded-keyboard-save-issue",
      "timestamp": "2026-08-31T18:59:38.482Z",
      "actor": "test",
      "kind": "enter",
      "target": {
        "role": "button",
        "name": "Save changes"
      },
      "input": "Enter"
    }
  ],
  "finishedAt": "2026-08-31T18:59:39.077Z",
  "results": {
    "pass": 0,
    "fail": 3,
    "unknown": 0
  }
}